{
    "name": "test mechanism",
    "description": "a crank slider.",
    "joints": [
        {
            "id": 0,
            "type": "Grounded",
            "name": "ground",
            "pos": [
                0,
                0
            ],
            "groundPos": [
                0,
                0
            ]
        },
        {
            "id": 1,
            "type": "Free",
            "name": "crank",
            "pos": [
                100,
                0
            ]
        },
        {
            "id": 2,
            "type": "Prismatic",
            "name": "slider",
            "pos": [
                300,
                0
            ],
            "slide": {
                "axis": [
                    1,
                    0
                ],
                "pos": [
                    0,
                    0
                ]
            }
        }
    ],
    "links": [
        {
            "id": 0,
            "jointA": 1,
            "jointB": 2,
            "length": 200,
            "name": "coupler"
        }
    ],
    "drivings": [
        {
            "type": "Position",
            "jointA": 1,
            "jointB": 0,
            "name": "crank drive",
            "posX": "100*cos(10*t)",
            "posY": "100*sin(10*t)",
            "velX": "-1000*sin(10*t)",
            "velY": "1000*cos(10*t)",
            "accX": "-10000*cos(10*t)",
            "accY": "-10000*sin(10*t)"
        }
    ]
}